Time,Category,Message,Status,Flag,Scope,Sector,RacingNumber,Lap
2024-02-29 14:45:10,Other,RISK OF RAIN FOR F1 SECOND PRACTICE SESSION IS 0%,,,,,,
2024-02-29 14:52:46,Other,PINK HEAD PADDING MATERIAL MUST BE USED,,,,,,
2024-02-29 15:00:00,Flag,GREEN LIGHT - PIT EXIT OPEN,,GREEN,Track,,,
2024-02-29 15:01:44,Other,PIT EXIT INCIDENT INVOLVING CAR 77 (BOT) NOTED - PIT LANE INFRINGEMENT,,,,,,
2024-02-29 15:04:11,Other,FIA STEWARDS: PIT EXIT INCIDENT INVOLVING CAR 77 (BOT) UNDER INVESTIGATION - PIT LANE INFRINGEMENT,,,,,,
2024-02-29 16:00:00,Flag,CHEQUERED FLAG,,CHEQUERED,Track,,,
2024-02-29 16:00:06,Other,FIRST CAR TO TAKE THE FLAG - CAR 31 (OCO),,,,,,
2024-02-29 16:07:50,Flag,DOUBLE YELLOW IN TRACK SECTOR 6,,DOUBLE YELLOW,Sector,6.0,,
